case_num,publication_num,decision_date,court_provided_header,court_provided_keywords,court_provided_class,legal_area,applicant_names,applicant_class,respondent_names,respondent_class
B 620-82,NJA 1982 s. 511,1982-09-03,"En sjuttonårig narkotikaberoende yngling, som efter att ha vistats på yrkesskola beretts plats på behandlingshemmet Hasselakollektivet, har som påföljd för bl a allvarlig narkotikabrottslighet överlämnats för vård inom socialtjänsten. 31 kap 1 § BrB.","Socialtjänst,Vård,Narkotikaberoende,Unga",B,8,åklagaren,Oa,J.A.,Pm
B 626-88,NJA 1988 s. 701,1988-12-20,"En person har använt ett för honom utfärdat betalkort (sparbankskort) vid betalning för varor och tjänster, oaktat täckning saknades på det till kortet anslutna bankkontot. Fråga, med hänsyn till en mellan säljföretagen och serviceföretag för sparbankerna träffad överenskommelse, huruvida det i 9 kap 1 § 1 st BrB angivna skaderekvisitet vid bedrägeri är uppfyllt.","Betalkort,Täckning,Skaderekvisit,Bedrägeri",B,8,åklagaren,Oa,S.L.,Pm
B 628-87,NJA 1987 s. 968,1987-12-23,Brott enligt bestämmelsen i 12 kap 65 a § 4 st JB - som funnits tillämplig även när hyresavtal avser en bostadsrättslägenhet - har med hänsyn till bestämmelsens ordalydelse ansetts inte kunna begås förrän efter det att det föreligger ett hyresavtal mellan parterna.,"Bostadsrätt,Hyra,Oskälighyra",B,19,åklagaren,Oa,I.M.,Pw
B 643-85,NJA 1986 s. 736,1986-12-22,"Frågor i mål om ansvar å den som vid en rad tillfällen förvärvat narkotika för omedelbar konsumtion, huruvida straffbart innehav uppkommit och, om så var fallet, huruvida förvärven skulle bedömas vart för sig såsom narkotikaförseelse eller tillsammans som ett narkotikabrott. 1 och 2 §§ narkotikastrafflagen (1968:64) i dess lydelse närmast före d 1 juli 1983 och d 1 mars 1985.","Narkotika,Innehav,Narkotikaförseelse,",B,8,åklagaren,Oa,B.E.,Pm
B 647-82,NJA 1983 s. 479,1983-06-17,Åtal för försvårande av skattekontroll enligt 10 § skattebrottslagen (1971:69). Fråga dels om konkurrens mellan nämnda bestämmelse och straffbestämmelser i brottsbalken dels om utgångspunkten för beräkning av preskriptionstiden vid försvårande av skattekontroll.,"Skattekontroll,Preskription,Lagkonkurrens",B,22,åklagaren,Oa,S-O.S.,Pm
B 648-83,NJA 1984 s. 745,1984-10-31,"När det vid rymning inte kommer i fråga att välja en icke frihetsberövande påföljd, har fjorton dagars fängelse ansetts vara en i flertalet fall tillräcklig påföljd.","Rymning,Brottspåföljd,Fängelse",B,8,åklagaren,Oa,S.S.,Pm
B 651-82,NJA 1982 s. 525,1982-09-03,"Fråga, i tre särskilda fall i mål om ansvar enligt narkotikastrafflagen (1968:64), i vad mån åklagarens gärningsbeskrivning över huvud innefattade påståenden om någon enligt nämnda lag straffbar gärning. Tillika frågor om vilka krav som skall ställas på bevisningens styrka.","Narkotikabrott,Gärningsbeskrivning,Beviskrav",B,18,åklagaren,Oa,"M.T.,G.H.,S.E.,R.B.,W.A.","Pm,Pm,Pm,Pm,Pw"
B 654-81,NJA 1983 s. 662,1983-10-21,"Strejkande arbetstagare, som befann sig på sin arbetsplats (en inhägnad hamnterminal), utnyttjade sin vistelse där för att störa arbetsgivarföretagets verksamhet genom åtgärder som innefattade egenmäktigt förfarande. De anmanades därefter av en arbetsgivarrepresentant att avlägsna sig, men de kvarstannade likväl på arbetsplatsen. Genom kvarstannandet har de ansetts ha gjort sig skyldiga till olaga intrång. 4 kap 6 § 2 st BrB.","Strejk,Egenmäktigtförfarande,Olagaintrång,",B,8,åklagaren,Oa,"H.V.,T.H.","Pm,Px"
B 660-82,NJA 1983 s. 286,1983-03-15,Fråga om tillämpning av lagen (1974:1065) om visst stöldgods m m.,"Förverkande,Stöldgods",B,8,åklagaren,Oa,B.B.,Pw
B 667-88,NJA 1988 s. 413,1988-08-17,Fråga om ådömande av s k kontraktsvård.,"Kontraktsvård,Brottspåföljd,Skyddstillsyn,",B,8,åklagaren,Oa,J.G.,Pw
B 672-81,NJA 1982 s. 17,1982-01-12,"Fråga om val av påföljd för grov stöld, särskilt med avseende på möjligheten att förena skyddstillsyn med fängelse. 1 kap 7 §, 27 kap 2 §, 28 kap 2 och 3 §§ BrB.","Brottspåföljd,Grovstöld,Häleriförseelse",B,8,åklagaren,Oa,"M.B.,W.N.,K.O.,H.T.","Pm,Pm,Pm,Pm"
B 674-80,NJA 1982 s. 714,1982-11-25,En bilförare företog i början av januari på en större väg med en hastighet av ungefär 70 km/tim en omkörning av en långtradare. Därvid kom bilen i sladdning och törnade mot långtradaren. Bilföraren har ej befunnits skyldig till vårdslöshet i trafik. 1 § 1 st lagen om straff för vissa trafikbrott.,"Bilförare,Vårdslöshetitrafik,Omkörning",B,8,åklagaren,Oa,K.S.,Pw
B 676-86,NJA 1986 s. 821,1986-12-23,"I mål angående sexuellt utnyttjande av underårig, en 5-årig dotter, förnekade den tilltalade mannen den påstådda gärningen. Flickan hade berättat om ett övergrepp dels spontant för modern, dels för en barnpsykolog som i behandlingssyfte hade samtal med flickan. Som bevisning till styrkande av den åtalade gärningen åberopades vid huvudförhandling i målet bandupptagning av samtalen med barnpsykologen samt utsagor av bl a henne och modern. Fråga, om flickans berättelse kunde med hänsyn till sitt innehåll och till de omständigheter under vilka den tillkommit utgöra tillräckligt bevis för fällande dom.","Sexuelltutnyttjande,Bevisning,Barnpsykolog",B,8,åklagaren,Oa,H.S.,Pm
B 678-87,NJA 1988 s. 40,1988-02-09,Våldtäkt enligt 6 kap 1 § 1 st eller 2 st BrB?,"Våldtäkt,Grovvåldtäkt",B,8,åklagaren,Oa,N.K.,Pm
B 68-82,NJA 1983 s. 317,1983-03-23,Fråga om tillämpning av bestämmelsen i 23 § naturvårdslagen (1964:822) om förbud mot nedskräpning.,"Nedskräpning,Miljöbrott",B,11,"åklagaren, Ludvika kommun","Oa,Om",K.R.,Pm
B 687-81,NJA 1982 s. 350,1982-06-21,Fråga - i fyra fall - om bestämmande av påföljden för rattfylleri under hänsynstagande till de svårigheter som återkallelse av körkort medfört för gärningsmannen i hans yrkes- eller näringsverksamhet. 6 § lagen (1951:649) om straff för vissa trafikbrott och 26 kap 1 § BrB.(I-IV).,"Rattfylleri,Brottspåföljd,Näringsverksamhet,",B,8,"åklagaren,åklagaren,åklagaren,åklagaren","Oa,Oa,Oa,Oa","M.B.,K.N.,O.H.,I.S.","Pm,Pm,Pm,Pm"
B 693-87,NJA 1987 s. 757,1987-11-11,"En person som är intagen i kriminalvårdsanstalt har befunnits skyldig till narkotikainnehav inom anstalten. Fråga om inverkan på straffmätningen av att han i anledning av innehavet dels blivit föremål för olika åtgärder inom anstalten med stöd av lagen (1974:203) om kriminalvård i anstalt, dels riskerar att tidpunkten för villkorlig frigivning påverkas.","Narkotikainnehav,Intagen,Anstalt,Villkorlig",B,8,åklagaren,Oa,R.U.,Pm
B 696-83,NJA 1985 s. 893,1985-12-23,Intrång i författares upphovsrätt har skett genom kulturpolitisk artikel i daglig tidning. Fråga om begränsning av ansvaret för detta intrång till f ö för motstående yttrandefrihetsintresse.,"Upphovsrätt,Intrång,Tidningsartikel,",B,"14,8","åklagaren,P.O.","Oa,Pm","K.B.,L.H.","Pm,Pm"
B 697-80,NJA 1981 s. 474,1981-04-08,Straffmätning vid lydnadsbrott. 21 kap 1 § BrB.,"Straffmätning,Brottspåföljd,Lydnadsbrott",B,8,åklagaren,Oa,B.S,Pm
B 697-88,NJA 1989 s. 456,1989-07-26,"V skulle enligt uppgjord plan för annan persons räkning på utrikes ort och i överlåtelsesyfte förvärva narkotika och därefter olovligen införa den till riket. Två-tre dagar efter det att V köpt en vara, som han trodde var cannabisharts, påbörjade han återresa till Sverige. Sedan varan upptäckts vid tullkontroll och tagits i beslag har det visat sig att den bestod av henna och bivax och inte av narkotika. Åtal mot V för försök till varusmuggling har ogillats. 23 kap i § BrB och 8 § lagen (1960:418) om straff för varusmuggling.","Försöktillvarusmuggling,Smuggling,",B,8,åklagaren,Oa,R.V.,Pm
B 702-82,NJA 1983 s. 339,1983-04-06,"Bestämmande av påföljd för olaga frihetsberövande och olaga tvång, som förövats mot en 15-årig pojke med anledning av att denne tillgripit en gärningsmannens son tillhörig motorcykel.","Olagafrihetsberövande,Olagatvång,Tillgrepp,",B,8,åklagaren,Oa,"H.L.,B-B.L.,J.E.,J.N.,S.J.","Pm,Pm,Px,Px,Pm"
B 703-88,NJA 1989 s. 807,1989-12-19,Beslut av värnpliktsverket att ej hänskjuta fråga om ny inkallelse av den som tidigare vägrat fullgöra värnpliktstjänstgöring till regeringen (68 § 3 st kungörelsen 1969:380 om värnpliktigas tjänstgöring m m) kan inte frånkännas rättsverkan i mål om värnpliktsbrott annat än i speciella undantagssituationer.,Värnpliktsbrott,B,8,åklagaren,Oa,D.T.,Pm
B 713-83,NJA 1984 s. 641,1984-09-11,"Tilltalad har ansetts enligt 31 kap 2 § RB berättigad till ersättning av allmänna medel för kostnader för privat försvarare i högre rätt, när denna, utan att ogilla åtalet, har meddelat en dom som enligt 31 kap 10 § RB inte skall anses som fällande (I och II). Den tilltalade, som fullföljt talan mot HovR:ns dom endast i kostnadsfrågan, har tillerkänts ersättning av allmänna medel för sina rättegångskostnader i HD (II).","Privatförsvarare,Ersättning,",B,18,åklagaren,Oa,"R.D.,M.Z.,Z.Z.","Pm,Px,Px"
B 716-81,NJA 1982 s. 114,1982-02-22,Fråga om beviskrav i mål om rattfylleri.,"Beviskrav,Bevisning,Rattfylleri,Vårdslösheti",B,8,åklagaren,Oa,M.W.,Pm
B 717-86,NJA 1988 s. 383,1988-06-16,"Revisor, som vid utförandet av sitt uppdrag varit oaktsam och avgett s k rena revisionsberättelser, har fällts till ansvar för medhjälp till bokföringsbrott som begåtts under följande räkenskapsår.","Oaktsamhet,Revisor,Medhjälp,Bokföringsbrott",B,"22,8",åklagaren,Oa,"G.P.,E.P.,R.T.","Pm,Pw,Pm"
B 717-87,NJA 1987 s. 680,1987-10-06,"En person reste enligt - i samråd med andra - uppgjord plan till utrikes ort, medförande egna pengar i syfte att inköpa ett narkotikaparti som skulle tillhandahållas honom för vidare försäljning i Sverige. Bestämmelsen i 1 § 5 narkotikastrafflagen (1968:64) om narkotikabrott genom befordran av vederlag för narkotika har ansetts ej vara tillämplig. Förfarandet har i stället bedömts som försök till grovt narkotikabrott och pengarna har förklarats förverkade enligt 6 § 2 st andra meningen narkotikastrafflagen.","Narkotika,Förverkande,Försök,Narkotikabrott",B,8,åklagaren,Oa,J.M.,Pm
B 719-80,NJA 1981 s. 426,1981-03-02,"Fråga om utvisning av finländsk medborgare, som varit bosatt i Sverige sedan mer än fyra år. 41 § utlänningslagen (1980:376).","Utvisning,Förvisning",B,"16,8",åklagaren,Oa,P.S.,Pm
B 719-85,NJA 1987 s. 643,1987-09-14,"En byggsats om tre delar till armborst har jämte monteringsanvisning överlåtits till en person som saknar tillstånd enligt vapenlagen (1973:1176) att inneha sådant vapen. Ingen av de enskilda armborstdelarna har i och för sig fordrat tillstånd för innehav. Med hänsyn till att delarna enkelt och snabbt kunnat sättas ihop till ett skjutbart vapen, har överlåtelsen ansetts gälla ett komplett armborst och medföra straffansvar för överlåtaren.","Vapen,Tillstånd,Straffansvar,Byggsats",B,8,åklagaren,Oa,M.S.,Pm
B 722-83,NJA 1983 s. 741,1983-11-18,"Sedan allmän åklagare ansökt om stämning på aktiebolag och yrkat utdömande av bolaget förelagt vite, har TR:n utfärdat stämning icke på bolaget utan på bolagets verkställande direktör att svara på åtalet. Delgivning av stämningen med denne har ej medfört att bolaget ansetts ha fått del av åtalet med preskriptionsavbrytande verkan enligt 35 kap 1 § BrB.","Vite,Aktiebolag,Verkställandedirektör,",B,8,åklagaren,Oa,"C.M.,Vingresor/Club 33 AB","Pm,Cs"
B 728-82,NJA 1984 s. 700,1984-10-08,"7 § 1 st 3 lagen (1976:666) om påföljder och ingripanden vid olovligt byggande m m har - liksom 75 § 1 st d byggnadsstadgan (1959:612) - ansetts inbegripa åtgärder genom vilka del av byggnad inredes till väsentligen annat ändamål än det till vilket den delen tidigare varit använd, oavsett vilken användning övriga delar av byggnaden tidigare haft. - Tillika fråga om jämkning av tilläggsavgift vid olovligt byggande.","Olovligtbyggande,Ändamål,Tilläggsavgift",B,"19,8",åklagaren,Oa,Sydrevisorer Udevalla AB,Cs
B 728-85,NJA 1985 s. 544,1985-08-27,I anledning av åtal för försök till grov stöld uppkommer fråga om faran för brottets fullbordande var utesluten på grund av tillfälliga omständigheter (23 kap 1 § BrB). Tillika fråga om viss av polisen använd spaningsmetod kunde utgöra grund för strafflindring.,"Stöld,Försök,Grovstöld,Strafflindring",B,8,åklagaren,Oa,"J.R.,J.N.","Pm,Pm"
B 73-80,NJA 1981 s. 477,1981-04-09,Fråga om mutbrotts- och bestickningsansvar för julgåvor som en företagare lämnat kommunala tjänstemän.,"Mutbrott,Bestickning,Tjänsteman,Kommun,Gåva",B,8,åklagaren,Oa,"B.J.,A.W.,L.B.,S.E.,L.H.,H.L.,S.N.,K.O.,G.R.,B.O.","Pm,Pm,Px,Px,Px,Pm,Pm"
B 746-83,NJA 1984 s. 837,1984-11-13,"Förverkande av spelautomater av typ Draw Poker jämte fjärrkontroller som av ett aktiebolag hyrts ut till olika lokalinnehavare, vilka anordnat olovligt spel med dem. Tillämpning av 11 § 2 st lotteriförordningen (1939:207).","Spelautomat,Förverkande,Olovligtspel",B,8,åklagaren,Oa,"19 tilltalade,K.W.,L.R.,A.N.","Px,Pm,Pm,Pm"
B 755-83,NJA 1984 s. 80,1984-02-16,Underlåtenhet av domare att lämna underrättelse om begånget fel från domstolens sida har ansetts ej utgöra myndighetsutövning och därför inte kunna medföra straffansvar enligt 20 kap 1 § BrB. På motsvarande sätt har bedömts meddelande till parterna om ifrågasatt rättelse enligt 17 kap 15 § RB. Fråga också huruvida visst handläggningsfel - företagande av tvistemål till omedelbar huvudförhandling i strid med 42 kap 20 § 2 st RB - var att anse som grovt oaktsamt i straffbestämmelsens mening.,"Underlåtenhet,Underrättelse,Fel,",B,8,chefsåklagaren,Oa,M.V.K.,Pm
B 757-86,NJA 1986 s. 802,1986-12-19,En man har dödats genom knivhugg. Två män har åtalats i anledning av det inträffade. Ansvar har yrkats å den ene för mord och å den andre för medhjälp till grov misshandel och medhjälp till vållande till annans död. Vem som utdelat de dödande knivhuggen har inte kunnat fastställas närmare än att det varit en av de tilltalade. Den för mord åtalade har därför frikänts. Den andre har däremot fällts till ansvar i huvudsaklig överens stämmelse med ansvarsyrkandet mot honom.,"Mord,Medhjälp,Grovmisshandel",B,8,åklagaren,Oa,"O.L.,K.P.","Pm,Pm"
B 778-81,NJA 1981 s. 1076,1981-11-20,Konkreta föremål som utgjort betalning för narkotika kan förklaras förverkade som vinning av narkotikabrott. 6 § 1 st narkotikastrafflagen (1962:64).,"Betalning,Narkotika,Förverkande,Vinning,",B,8,åklagaren,Oa,P.D.,Pm
B 787-85,NJA 1986 s. 533,1986-10-07,"Fråga i mål om åtal för varusmuggling avseende införsel av visst preparat som utgör läkemedel om innebörden av bestämmelsen i 8 § 4 mom läkemedelsförordningen (1962:701) att resande får införa läkemedel, som han för personligt bruk medför till riket. Krävs för rätt till införsel att den resande avser att använda preparatet som läkemedel?","Varusmuggling,Smuggling,Läkemedel",B,8,åklagaren,Oa,E.H.,Pm
B 788-86,NJA 1987 s. 676,1987-10-06,"Fråga i visst fall om ansvar för hastighetsöverträdelse. Straff har ansetts inte böra ådömas för överträdelse av 7 § vägtrafikkungörelsen (1972:603), när vägtrafikant åsidosätter anvisning för trafiken meddelad genom vägmärke som grundar sig på en lokal trafikföreskrift.","Hastighetsöverträdelse,Vägmärke,Lokal",B,8,åklagaren,Oa,K.G.L.,Pm
B 803-80,NJA 1981 s. 327,1981-02-19,Fråga om utvisning på grund av brott. Tillika spörsmål om tillämpning av 34 kap 6 § 1 st BrB.,"Utvisning,Återfall,Stöld,Fängelse",B,8,åklagaren,Oa,J.S.,Pm
B 805-85,NJA 1987 s. 194,1987-04-06,Då åtal väckts för skattebedrägeri har frågan om ansvar för vårdslös skatteuppgift inte ansetts kunna komma under bedömande utan att åtalet justerats före utgången av preskriptionstiden för sistnämnda brott.,"Åtalsjustering,Skattebedrägeri,Vårdslös",B,"18,22",åklagaren,Oa,J.F.,Pm
B 805-87,NJA 1987 s. 771,1987-11-18,Iransk medborgare utlämnades från Danmark till Sverige för bl a grova narkotikabrott som begåtts i Danmark. Fråga om svensk domsrätt beträffande narkotikabrotten kan grundas på att han efter utlämningen finns i Sverige. 2 kap 2 § 1 st 3 BrB.,"Narkotikabrott,Svenskdomsrätt,Forum,",B,18,åklagaren,Oa,A.G.,Pm
B 806-88,NJA 1989 s. 656,1989-11-16,"Fråga huruvida exemplar av protokoll över husrannsakan och kroppsvisitation och över beslag, vilka upprättats med användande av blankettset, utgör urkunder i den mening som avses i 14 kap 1 § BrB. Tillika fråga huruvida ändringar, vilka den åklagare som hade beslutat åtgärderna i efterhand företagit i protokollen, kan anses ha skett falskeligen och inneburit fara i bevishänseende.","Förfalskning,Urkund,Faraibevishänseende,",B,8,åklagaren,Oa,B.S.,Pw
B 813-83,NJA 1983 s. 754,1983-11-23,Fråga om avvägning av farlighetsgraden hos kokain som underlag för bedömande huruvida visst narkotikabrott bör anses grovt och för straffmätningen (I och II).,"Kokain,Narkotikabrott,Brottspåföljd,",B,8,"åklagaren,åklagaren","Oa,Oa","R.W.,J.O.,L.C.","Pm,Pm,Pm"
B 814-88,NJA 1989 s. 810,1989-12-20,Fråga om bedrägerier som avsåg varor till ett värde av omkring 185 000 kr skulle bedömas enligt 9 kap 1 eller 3 § BrB. Tillika fråga om påföljd för grovt bedrägeri.,"Grovtbedrägeri,Villkorligdom,Brottspåföljd,",B,8,åklagaren,Oa,"M.H.,G.N.,J.J.","Pw,Pw,Pm"
B 83-82,NJA 1983 s. 441,1983-06-17,Frågor rörande bedrägeri och trolöshet mot huvudman. Tillika spörsmål beträffande den s k specialitetsprincipen vid utlämning.,"Bedrägeri,Trolöshetmothuvudman,",B,8,åklagaren,Oa,"B.E.,I.W.,F.M.","Pm,Pm,Pm"
B 835-87,NJA 1988 s. 279,1988-05-19,En man som haft samlag med en psykiskt sjuk kvinna åtalades för sexuellt utnyttjande. Åtalet har ogillats på den grunden att det inte kunde anses att mannen förmått kvinnan till det sexuella umgänget. 6 kap 3 § BrB.,"Sexuelltutnyttjande,Tvång,Psykisksjukdom",B,8,åklagaren,Oa,R.L.,Pm
B 836-83,NJA 1984 s. 641,1984-09-11,"Tilltalad har ansetts enligt 31 kap 2 § RB berättigad till ersättning av allmänna medel för kostnader för privat försvarare i högre rätt, när denna, utan att ogilla åtalet, har meddelat en dom som enligt 31 kap 10 § RB inte skall anses som fällande (I och II). Den tilltalade, som fullföljt talan mot HovR:ns dom endast i kostnadsfrågan, har tillerkänts ersättning av allmänna medel för sina rättegångskostnader i HD (II).","Privatförsvarare,Ersättning,",B,18,åklagaren,Oa,"R.D.,M.Z.,Z.Z.","Pm,Px,Px"
B 841-87,NJA 1988 s. 444,1988-09-19,"Fråga huruvida bilförare, som av annan bilförare påståtts ha haft del i trafikolycka, brutit mot 5 § 1 st lagen (1951:649) om straff för vissa trafikbrott genom att undandra sig att på förfrågan uppge sitt namn.","Trafikolycka,Bilförare,Namn",B,8,åklagaren,Oa,R.B.,Pm
B 850-83,NJA 1984 s. 236,1984-03-13,"I mål om ansvar för överträdelse av vissa bestämmelser i förordningen (1976:935) om skyddsområden och kontrollområden, såvitt de avser Blekinge kontrollområde, har villfarelse rörande bestämmelsernas innebörd funnits ej vara i straffrättslig mening ursäktlig.","Skyddsområde,Kontrollområde,Överträdelse,",B,8,åklagaren,Oa,K.L.,Pm
B 860-88,NJA 1988 s. 607,1988-12-06,"I mål mot E, T och L åberopade åklagaren av L lämnade uppgifter till stöd för åtalen mot E och T. TR:n ansåg sig inte kunna fälla E och T till ansvar på grund av L:s uppgifter utan biföll endast delvis åtalet mot dem. HovR:n, vid vilken L vägrade yttra sig, fann L:s uppgifter i TR:n tillförlitliga och biföll åtalet helt. HovR:ns förfarande har, då mycket starka skäl att frångå TR:ns värdering av L:s utsaga till nackdel för E och T inte förelegat, ansetts strida mot en grundläggande princip för bevisprövning. Jfr 51 kap 23 § RB.","Bevisning,Bevisvärdering,Rättegångsfel",B,18,åklagaren,Oa,"S.L.,J.G.,C.W.,J.E.,M.T.","Pm,Px,Pm,Pm,Pm"
B 866-86,NJA 1987 s. 604,1987-09-10,"En äldre man testamenterade sin fädernegård och övrig egendom till ett vårdbiträde, som utfört hemtjänst åt honom. Sedan han avlidit, tog vårdbiträdet emot den testamenterade egendomen. I mål mot henne om ansvar för mutbrott har det, med hänsyn till den utredning som förekommit om den särskilda bakgrunden till testamentet, inte ansetts visat att hon tagit emot egendomen såsom belöning i den mening som förutsätts för straffansvar. 20 kap 2 § BrB.","Testamente,Hemtjänst,Mutbrott,Belöning",B,"8,12",åklagaren,Oa,L.E.,Pw
B 875-81,NJA 1982 s. 719,1982-11-25,"En fabriksarbetare har under flera år tillgripit varor på sin arbetsplats. Värdet av det tillgripna, sammanlagt drygt 25 000 kr, har ansetts ligga klart under gränsen för vad som ensamt bör föranleda att en stöld bedöms som grov.","Arbetstagare,Tillgrepp,Stöld,Grovstöld",B,8,åklagaren,Oa,T.T.,Pm
B 882-81,NJA 1982 s. 350,1982-06-21,Fråga - i fyra fall - om bestämmande av påföljden för rattfylleri under hänsynstagande till de svårigheter som återkallelse av körkort medfört för gärningsmannen i hans yrkes- eller näringsverksamhet. 6 § lagen (1951:649) om straff för vissa trafikbrott och 26 kap 1 § BrB.(I-IV).,"Rattfylleri,Brottspåföljd,Näringsverksamhet,",B,8,åklagaren,Oa,"M.B.,K.N.,O.H.,I.S.","Pm,Pm,Pm,Pm"
B 883-81,NJA 1982 s. 350,1982-06-21,Fråga - i fyra fall - om bestämmande av påföljden för rattfylleri under hänsynstagande till de svårigheter som återkallelse av körkort medfört för gärningsmannen i hans yrkes- eller näringsverksamhet. 6 § lagen (1951:649) om straff för vissa trafikbrott och 26 kap 1 § BrB.(I-IV).,"Rattfylleri,Brottspåföljd,Näringsverksamhet,",B,8,"åklagaren,åklagaren,åklagaren,åklagaren","Oa,Oa,Oa,Oa","M.B.,K.N.,O.H.,I.S.","Pm,Pm,Pm,Pm"
B 89-85,NJA 1985 s. 822,1985-12-17,"Fråga, om åtal för tillgreppsbrott var styrkt.","Tillgrepp,Styrktbrott,Båt",B,8,åklagaren,Oa,"T.P.,M.B.,G.J.","Pm,Pm,Pm"
B 896-85,NJA 1986 s. 432,1986-08-07,Fråga huruvida HovR:n fått avgöra ett mål utan huvudförhandling av det skälet att vadetalan varit uppenbart ogrundad. 51 kap 21 § 1 st 3 samt 3 och 4 st RB.,"Huvudförhandling,Ogrundadtalan",B,18,åklagaren,Oa,E.A.,Pm
B 897-85,NJA 1986 s. 117,1986-03-18,HovR har med tillämpning av 53 kap 2 § och 47 kap 5 § 1 st RB ogillat enskilt åtal utan att utfärda stämning. Sedan målsäganden fullföljt talan till HD har dom meddelats utan att revisionsinlagan delgivits den tilltalade.,"Enskiltåtal,Delgivning,Stämning",B,"18,8",B.E.,Px,T.P.,Px
B 901-83,NJA 1984 s. 520,1984-07-05,"En tilltalad, som av HovR:n dömts för vårdslös skatteuppgift jämte andra brott till gemensam påföljd och ålagts näringsförbud, har i sin revisionsinlaga yrkat frikännande från ansvar för vissa av brotten samt i vart fall ändring av påföljden. HD har meddelat prövningstillstånd i frågan om ansvar för vårdslös skatteuppgift samt påföljden. Sedan den tilltalade vid huvudförhandlingen yrkat frikännande från ansvar även för andra brott, av vilka vissa angivits i revisionsinlagan, och upphävande av näringsförbudet, har hans talan avvisats i de delar där prövningstillstånd ej meddelats. I fråga om åtal för vårdslös skatteuppgift, som avsett ett flertal mervärdeskattedeklarationer, anses felaktiga uppgifter som hänför sig till en och samma redovisningsperiod skola bedömas som en gärning för sig. Beträffande rekvisitet ""betydande belopp"" i 5 § skattebrottslagen - som funnits skola avgöras för varje gärning utan beaktande av om gärningen upprepats - har gränsen ansetts i allmänhet kunna sättas vid ungefär ett basbelopp.","Vårdslösskatteuppgift,Näringsförbud,Gemensam",B,"22,18",åklagaren,Oa,B.H.,Pm
B 906-82,NJA 1984 s. 662,1984-09-27,Fråga om tillämpning av den s k legalitetsprincipen i straffrätten.,"Legalitetsprincipen,Förverkande,Valutabrott",B,8,åklagaren,Oa,T.O.,Pm
B 909-82,NJA 1984 s. 447,1984-06-14,Val av påföljd för rattfylleri.,"Brottspåföljd,Rattfylleri",B,8,åklagaren,Oa,L.L.,Pm
B 910-85,NJA 1985 s. 757,1985-12-05,"En yngling, som med knivhugg orsakat en annan mans död, har ansetts ha vid huggen i vart fall varit helt likgiltig för om denne skulle dö eller ej, och han har därför fällts till ansvar för uppsåtligt dödande samt dömts för dråp. Påföljden för ynglingen, som dömdes även för grov misshandel vid ett annat tillfälle och vid brottens begående var 17 år men vid tiden för HD:s dom fyllt 18 år, har med hänsyn till omständigheterna bestämts så, att det enligt 31 kap 1 § 1 st BrB överlämnats åt socialnämnd att föranstalta om erforderlig vård inom socialtjänsten.","Dråp,Ungalagöverträdare,Brottspåföljd",B,8,åklagaren,Oa,J.A-T.,Pm
B 916-81,NJA 1983 s. 798,1983-11-09,"Enligt 117 a § 3 st vägtrafikkungörelsen (1972:603) behöver bilbälte inte användas av förare i yrkesmässig trafik för personbefordran. Bestämmelsen har ansetts tillämplig vid körning med taxibil under förarens arbetstid, oavsett om yrkesmässig transport faktiskt pågår eller inte, om inte föraren genom någon åtgärd satt sig ur stånd att utan nämnvärt dröjsmål tillhandagå allmänheten med körning mot ersättning.","Bilbälte,Taxiförare,Yrkesmässigtrafik",B,8,åklagaren,Oa,S.J.,Pm
B 916-82,NJA 1984 s. 296,1984-04-18,Vite har ansetts kunna föreläggas handelsbolag.,"Vite,Handelsbolag",B,4,åklagaren,Oa,"B.F.,Feedback Service Corporation Handelsbolag","Pm,Cs"
