case_num,publication_num,decision_date,court_provided_header,court_provided_keywords,court_provided_class,legal_area,applicant_names,applicant_class,respondent_names,respondent_class
T 339-02,NJA 2004 s. 3,2004-01-02,Självständig preskription har inte ansetts ske av styrelseledamöters ansvar enligt 13 kap. 2 § aktiebolagslagen (1975:1385) i paragrafens lydelse före den 1 januari 2002. Avbrott i preskription enligt 12 kap. 61 § JB har ansetts kunna ske genom att fordran anmäls i hyresgästens konkurs.,"Preskription,Aktiebolag,Styrelseledamot,",T,"7,6",Kommanditbolaget Kungsbron 21,Cs,"T.N.,M.O.","Px,Px"
T 3390-07,NJA 2009 s. 889,2009-12-22,Fråga om innebörden av kravet på överlåtarens besittning vid godtrosförvärv av lösöre.,"Besittning,Förfogandelegitimation,",T,6,Harley-Davidson Sweden AB,Cs,J.S.,Px
T 3406-02,NJA 2003 s. 302,2003-06-25,Säljaren av en fastighet väcker skadeståndstalan mot köparen på grund av att köpeavtalet är ogiltigt. Preskriptionstid för säljarens fordran har ansetts löpa från den dag då fastigheten vidareförsåldes och säljarens möjlighet att hävda äganderätt upphörde.,"Preskription,Skadestånd,Köpavfastegendom",T,"19,23",L.E.,Pm,R. Förvaltning Aktiebolag,Cs
T 3424-01,NJA 2004 s. 487,2004-07-06,Fråga om tolkning av testamente med förordnande om sekundosuccession.,"Testamente,Friförfoganderätt,Legat,",T,12,C.S.,Pm,A.-C.H.,Pw
T 3445-02,NJA 2004 s. 299,2004-05-26,"I mål om ställföreträdares betalningsansvar för juridisk persons skatter och avgifter uppkommer frågor om tolkning av tidigare gällande bestämmelser i mervärdesskattelagen (1994:200) (I), lagen (1968:430) om mervärdeskatt, lagen (1984:668) om uppbörd av socialavgifter från arbetsgivare (II) och 12 kap. 6 § skattebetalningslagen (1997:483) i lydelse före den 1 januari 2004 (I och II) samt fråga om retroaktiv tilllämpning av sistnämnda lagrum i lydelse efter den 1 januari 2004 (I och II).","Ställföreträdaransvar,Skattelag,",T,22,"Staten genom Skattemyndigheten i Stockholms län,Staten genom Skattemyndigheten i Linköping","Os,Os","A.M.,S.Å.","Pm,Pw"
T 3473-02,NJA 2004 s. 746,2004-12-15,Fråga om skyldighet för passagerare i olovligt tillgripen bil att ersätta skada som uppkommit på bilen genom vårdslöshet från förarens sida (I och II).,"Skadestånd,Casusmixtus,Kausalitet,Olovligt",T,23,"Allmän åklagare,Länsförsäkringar Sak Försäkringsaktiebolag,Bilens ägare, J.M.","Oa,Cs,Px,Pm","F.O., J.G., M.W.,I.W.,J.W.","Pm,Pm,Pm,Px,Px"
T 351-01,NJA 2001 s. 755,2001-11-28,Fråga om kommuns skadeståndsansvar gentemot en grundskoleelev som utsatts för mobbning i skolan.,"Skadestånd,Skadeståndsansvar,Kommun,Mobbning,",T,"23,9",J. R.,Pw,Grums kommun,Om
T 3584-01,NJA 2004 s. 499,2004-07-12,Preskription av hyresfordran. (Jfr NJA 2002 s.358),"Preskription,Hyresfordran",T,19,Fabrikör J.L. Eklunds Hantverksstiftelse,Xs,"B.M.,I.L.M","Px,Px"
T 3771-06,NJA 2010 s. 8,2010-01-14,"Med stöd av ett bemyndigande från regeringen meddelade Finsk-svenska gränsälvskommissionen föreskrifter som begränsade fisket i Torne älv. Regeringens bemyndigande hade inte lämnats i föreskriven ordning. Fråga i vad mån staten är skyldig att betala ersättning för ren förmögenhetsskada bestående i uteblivna intäkter till en yrkesfiskare som rättat sig efter kommissionens föreskrifter. (Jfr NJA 1996 s. 370, 2000 s. 637 och 2001 s. 210.)","Normbeslut,Regeringen,Skadestånd,Statens",T,"23,1",I.L.,Pm,Justitiekanslern,Os
T 389-01,NJA 2003 s. 37,2003-02-07,Fråga huruvida återvinningssvarande bort inse att överlåtare av andelar i handelsbolag genom överlåtelsen blev insolvent när risk förelåg för att en skattetransaktion skulle underkännas. 4 kap. 5 § KL.,"Konkurs,Återvinning,Insolvens,Närstående,Ond",T,10,Hjärtervägen Invest AB:s konkursbo,Xs,Flora Placering HB,Cs
T 3930-06,NJA 2008 s. 106,2008-02-13,"Vid delning av en kommun har de berörda kommunerna ansetts ansvara solidariskt för skadeståndsanspråk som grundar sig på åtgärder som vidtagits före delningen, när ansvaret inte reglerats på annat sätt i samband med delningen.","Kommundelning,Ekonomiskreglering,Solidariskt",T,"17,23","L.K.,E.S.,J.K","Px,Px,Pm",Uppsala kommun,Om
T 3933-01,NJA 2002 s. 577,2002-11-22,"Gäldenär, som hade flera skulder till en borgenär, har ansetts ha rätt att destinera sin betalning till en skuld för vilken frigörelsetiden var inne, utan hinder av att förfallodagen ännu inte inträtt. 9 kap. 5 § HB.","Betalning,Destinera,Förfallodag,Gäldenär,",T,6,R.B.,Pm,H.F.,Pw
T 394-07,NJA 2008 s. 457,2008-05-06,"Fråga vid gåva mot visst vederlag, s.k. blandad gåva, om giltigheten av ett villkor att egendomen, en fastighet, skall utgöra mottagarens enskilda egendom.","Makarsegendomsförhållanden,Bodelning,Enskild",T,12,C.E.,Pw,M.L.,Pm
T 397-07,NJA 2007 s. 571,2007-09-10,Hovrätt har tillerkänt den vinnande parten ersättning för rättegångskostnader vid tingsrätten utöver vad som yrkats. Fråga om fördelning av rättegångskostnaderna i Högsta domstolen när den förpliktade parten överklagat beslutet. 18 kap. 3 § RB.,"Rättegångskostnad,Kvittning,Onödigrättegång",T,18,Fenix Outdoor AB (”Fjällräven”),Cs,Sprom AB,Cs
T 399-07,NJA 2008 s. 1208,2008-12-29,"Återvinning i konkurs. Frågor om innebörden av rekvisitet ""avsevärt försämrat gäldenärens ekonomiska ställning"" i 4 kap. 10 § första stycket konkurslagen (1987:672). Det har ansetts att, vid betalningar till olika borgenärer, betalningarna till varje borgenär skall bedömas för sig.","Återvinning,Betalning,Konkurs",T,10,NFC Siljanhus AB:s konkursbo,Cs,GAR-BO Försäkring AB,Cs
T 400-06,NJA 2006 s. 683,2006-12-21,"Ett universitet har vid antagningen av nybörjare på juris kandidatprogrammet höstterminen 2003 reserverat tio procent av platserna för sökande med ""bägge föräldrar utrikes födda"", i syfte att öka den etniska och sociala mångfalden inom programmet. Samtliga sökande som antogs enligt denna urvalsgrund hade sämre meriter än andra sökande som inte blev antagna, däribland A och B. Universitetet har inte till stöd för förfarandet ansetts kunna åberopa undantaget från diskrimineringsförbudet i 7 § lagen (2001:1286) om likabehandling av studenter i högskolan. A och B har därför tillerkänts skadestånd av staten på grund av otillåten diskriminering.","Diskriminering,Etniskdiskriminering,Etnisk",T,"5,9","J.M.,C.L.","Pw,Pw",Justitiekanslern,Os
T 4000-02,NJA 2005 s. 335,2005-05-03,Fråga om jämkning av trafikförsäkringsavgift.,"Trafikförsäkring,Jämkning,Försäkring",T,23,Trafikförsäkringsföreningen,Es,K.F.,Pm
T 4017-02,NJA 2004 s. 69,2004-02-24,Ändring av förmånstagarförordnande? Fråga om ett överklagande till HD innefattat yrkande om att bli befriad från skyldigheten att ersätta motpartens rättegångskostnad i HovR:n. (Jfr NJA 1979 s. 293 och där angivna rättsfall samt NJA 1981 s. 683.),"Försäkring,Förmånstagarförordnande,Formkrav,",T,23,M.O.,Pw,Gamla Livförsäkringsaktiebolaget SEB Trygg Liv,Cs
T 4018-01,NJA 2004 s. 534,2004-06-24,Tolkning av försäkringsavtal.,"Försäkringsavtal,Försäkratintresse,Tredjeman",T,"23,6",Svenska Handelsbanken AB,Cs,If Skadeförsäkring AB,Cs
T 402-02,NJA 2003 s. 540,2003-11-24,Fråga vid andrahandsupplåtelse av hyresrätt om rättsförhållandet utnyttjats för att kringgå rättsskyddet för hyresgäster. 7 kap. 31 § JB.,"Hyra,Andrahandshyresgäst,Andrahandsupplåtelse,",T,19,A.J.,Pw,T:s Förvaltning AB,Cs
T 4028-07,NJA 2011 s. 109,2011-04-27,Tre samebyar har befunnits ha en på sedvana grundad rätt till renskötsel (vinterbete) på privatägda fastigheter i Nordmalings kommun.,"Renskötselrätt, Sameby, Sedvanerätt, Vinterbete",T,"5,19",hundra fastighetsägare,Px,"Rans sameby,Vapstens sameby","Es,Es"
T 4101-06,NJA 2008 s. 668,2008-06-05,"En bil hade sålts genom ett avbetalningskontrakt med återtagandeförbehåll. Sedan köparen underlåtit att betala hela kontantinsatsen och den första månadsbetalningen, återtog säljarens rättsinnehavare bilen efter överenskommelse med köparen. Innan avräkning skett enligt konsumentkreditlagen stals bilen. Det har ansetts att säljaren tillägnat sig bilen redan vid återtagandet och att säljaren från och med den tidpunkten stått risken för varan. Till följd härav har säljarens rättsinnehavare ansetts som ägare av bilen vid tillämpning av villkoren i hans stöldförsäkring.","Äganderätt,Avbetalningskontrakt,Bil,",T,"6,23",Svenska Volkswagen Finans Aktiebolag,Cs,Trygg-Hansa Försäkringsaktiebolag,Cs
T 4133-06,NJA 2009 s. 16,2009-02-03,Byggföretag som anlitats av en bostadsrättsförening har orsakat vattenskada i en av föreningen ägd fastighet. Allmän förmögenhetsskada bestående i kostnad som innehavare av en skadad bostadsrättslägenhet haft för ersättningsboende har ansetts ersättningsgill oaktat att bostadsrättsföreningen och inte bostadsrättshavaren var ägare till fastigheten. Rätten till ersättning på utomobligatorisk grund har fått göras gällande direkt mot byggföretaget trots att detta anlitats av föreningen och oberoende av om bostadsrättshavaren av denna varit berättigad till ersättning för samma skada.,"Skadestånd,Allmänförmögenhetsskada,",T,"23,19",Svenska Konsumentförsäkringar AB,Cs,Bravida Mellersta AB,Cs
T 4164-05,NJA 2007 s. 953,2007-12-04,Bestämmande av ersättning för sveda och värk som till följd av två anhörigas dödsfall åsamkats en person som stod de avlidna särskilt nära.,"Skadestånd,Anhörigersättning,Svedaochvärk",T,23,"Allmän åklagare, R.J.,K.B.J.,I.J.,I.K.,A.J.,F.J.","Oa,Px,Px,Px,Px,Px,Px",U.G.,Pm
T 4171-05,NJA 2007 s. 519,2007-07-02,"Ett konkursbo som använt en hyreslokal efter det att konkursgäldenärens hyresavtal upphört att gälla, har ådragit sig massaansvar för hyresvärdens fordran på ersättning motsvarande skälig hyra för nyttjandet av lokalen.","Konkurs,Hyresavtal,Massaansvar,",T,10,Oceanterminalen Fastighetsförvaltning Aktiebolag,Cs,Skoglund Transport System i Göteborg AB konkursbo,Xs
T 4233-01,NJA 2005 s. 142,2005-03-18,"Avtalsvillkor som ger leasegivare rätt att ändra avgift vid ränteändring avseende den egna finansieringen har ansetts medföra skyldighet att sänka avgiften vid räntesänkning. Tillika fråga om leasetagaren, sedan avtalet överlåtits, har rätt till återkrav mot förvärvaren för överlåtarens överdebiteringar.","Avtal,Leasing,Ränta,Räntejustering,",T,6,Stockholms tingsrätt J.W:s Åkeri Aktiebolag,Cs,Hoist Kredit Aktiebolag,Cs
T 4254-00,NJA 2001 s. 750,2001-11-20,Tolkning av villkor i försäkringsavtal innefattande rättsskydd.,"Rättsskyddsförsäkring,Avtalstolkning,",T,6,Advokaten S. L. AB,Cs,Trygg-Hansa Försäkrings AB,Cs
T 4286-00,NJA 2003 s. 619,2003-12-19,Motorväg har anlagts över jord- och skogsbruksfastigheter. I mål om ersättning för upplåtelse av vägrätt uppkommer fråga om beräkning av minskning av fastighets marknadsvärde samt fråga om toleransavdrag och dess beräkning.,"Vägrättsersättning,Toleransavdrag,",T,"19,23","F.H.,C.H.,G.H.,J.S.,F.S..A.S.","Px,Px,Px,Pm,Px,Px",Vägverket,Oa
T 4304-05,NJA 2008 s. 451,2008-04-28,Efterlevande make har genom en särskild framställning begärt att bodelningen mellan honom och den avlidna hustruns arvingar skall jämkas så att vardera sidan som sin andel behåller sitt giftorättsgods (12 kap. 2 § första stycket första meningen äktenskapsbalken). Det har ansetts att framställningen skall beaktas utan hinder av att bodelning skett först sedan båda makarna har avlidit.,"Bodelning,Jämkning",T,12,"F.E.G.,K.E.","Px,Px",C.G.,Px
T 4320-02,NJA 2004 s. 19,2004-01-28,Arvode för förvaltning av handelsbolags angelägenheter.,Handelsbolag,T,7,Kiboc AB,Cs,"Hemiur AB,Rotunda Konsult AB,IVF-AB","Cs,Cs,Cs"
T 4387-07,NJA 2009 s. 128,2009-03-31,Enligt tillämpligt skiljereglemente skulle en skiljedom innehålla domskäl. Part har klandrat skiljedomen på den grunden att skiljenämnden i stor utsträckning skulle ha underlåtit att ange eller lämnat ofullständiga eller motstridiga domskäl. Frågor om tillämplig klandergrund i 34 § första stycket lagen (1999:116) om skiljeförfarande och vilka krav som kan ställas på domskälen.,"Domskäl,Klandertalan,Skiljedom",T,3,Soyak International Construction & Investment Inc,Cf,Hochtief AG,Cf
T 44-07,NJA 2009 s. 79,2009-03-06,"Att en leasegivare tillåter leasetagaren att förfoga över leasingobjektet hindrar inte i sig att leasegivaren har separationsrätt till leasingobjekt, om förfoganderätten inte utnyttjats.","Leasing,Förfogandeförbud,Förfogandemedgivande,",T,6,"K.J:s Maskin,Fritid AB:s konkursbo",Cs,Wasa Kredit AB,Cs
T 4406-01,NJA 2002 s. 630,2002-12-16,"Enligt besiktningsprotokoll var en entreprenad behäftad med vissa fel. Fråga om entreprenören kunnat få felansvaret överprövat av domstol genom en talan om betalning av entreprenadsumman (ej fastställelsetalan), väckt först sedan nära två år förflutit från besiktningen. Dessutom fråga om entreprenörens ansvar för konstruktionens lämplighet.","Entreprenad,Besiktning,Funktionsansvar",T,6,B.B. Montageservice AB,Cs,Restaurang AB Pelé,Cs
T 4439-00,NJA 2002 s. 441,2002-10-23,Återvinning i konkurs. Fråga huruvida en förtida betalning (delbetalning på konvertibelt förlagslån i anslutning till uppköp av ett aktiebolag) kunde anses som ordinär. 4 kap. 10 § konkurslagen.,"Konkurs,Ordinärbetalning,Återvinning",T,10,Ekströms Gerdsken Aktiebolags i likvidation konkursbo,Cs,J.S.,Pm
T 4474-07,NJA 2009 s. 64,2009-02-19,Mot en gäldenärs betalningsinvändning mot krav på betalning enligt ett skuldebrev invänder borgenären att han har avräknat betalningen mot en annan fordran. Gäldenären bestrider existensen av denna fordran. Fråga om bevisbördan.,"Bevisbörda,Avräknigsordningen,Fordran,",T,6,A.K.J.,Pm,A.A.,Pm
T 4509-02,NJA 2004 s. 288,2004-05-25,"Fråga om uppsägningsrätt och uppsägningstid avseende en till tiden obegränsad, vederlagsfri upplåtelse av nyttjanderätt till fast egendom.","Fastegendom,Nyttjanderätt,Uppsägning",T,19,L.S.,Pm,R.W,Pm
T 4595-06,NJA 2007 s. 461,2007-06-08,En person som skadats i en trafikolycka och då varit arbetslös har erhållit ersättning för inkomstförlust beräknad utifrån en högre inkomst än han hade som arbetslös eftersom han gjort sannolikt att han skulle ha fått denna högre inkomst om skadan inte hade inträffat.,"Beviskrav,Inkomstförlust,Inkomstunderlag,",T,23,T.K.,Pm,Länsförsäkringar Sak Försäkringsaktiebolag,Cs
T 4641-07,NJA 2009 s. 244,2009-05-15,I mål mot A med krav på att denne såsom registrerad ägare till en bil skall utge trafikförsäkringsavgift har A invänt att han inte är ägare till bilen och att hans namnteckning förfalskats på anmälan om ägarbyte. Försäkringsplikten har ansetts åvila A när han inte gjort sitt påstående sannolikt.,"Trafikförsäkringsavgift,Bevisbörda,Beviskrav",T,23,Trafikförsäkringsföreningen,Es,T.H.,Pm
T 4675-01,NJA 2004 s. 874,2004-12-29,I ett försäkringsmål har i tingsrätten åberopats läkarintyg och vittnesförhör med de intygande läkarna. Hovrätten har inte tillåtit att nya läkarintyg och omförhör med läkarna åberopas där till den del de grundar sig på undersökningar efter tingsrättens dom. Intygen och förhören har ansetts inte utgöra nya bevis och därför tillåtits utan begränsningar.,"Bevisning,Nybevisning,Preklusion",T,18,W.M.,Pm,Länsförsäkringar Stockholm,Cs
T 4697-01,NJA 2003 s. 89,2003-03-11,Försäkring av tredje mans intresse. Sedan försäkringstagaren väckt talan mot försäkringsgivaren angående försäkringsersättningen har fråga uppkommit om åberopsbördan då det gäller hans rätt att föra sådan talan. 57 § 2 st. lagen (1927:77) om försäkringsavtal.,"Försäkring,Tredjeman,Talerätt,Åberopsbörda",T,"23,18",J.O. med firma The Mine of Gems,Cs,Trygg-Hansa Försäkrings AB,Cs
T 4705-07,NJA 2008 s. 1192,2008-12-23,"Ett läkemedelsföretag har hos Läkemedelsförmånsnämnden (numera Tandvårds- och läkemedelsförmånsverket) i samband med ansökan om subventionering begärt att ett pris bestäms för ett generiskt läkemedel, som omfattades av ett patent. Åtgärden har inte ansetts innebära att företaget bjudit ut läkemedlet i 3 § patentlagens mening.","Patentintrång,Läkemedelsförmån",T,14,Pfizer AB,Cs,STADApharm AB,Cs
T 4750-00,NJA 2002 s. 477,2002-11-06,"Fråga om det, på grund av en felaktig uppgift om lägenhetsytan i hyresavtal och vid senare hyresförhandlingar, förelåg ett på utfästelse grundat skadeståndsansvar för hyresvärden gentemot hyresgästen och hur skadan i sådant fall skulle beräknas.","Utfästelse,Hyra,Skadestånd",T,19,Wallro i Västerås AB,Cs,M. E.,Pw
T 4750-07,NJA 2009 s. 182,2009-04-16,"A har från sin bank av misstag betalat för mycket till B, som kände till misstaget innan hans konto i en annan bank krediterades. A:s rätt till återbäring från B har ansetts inte gälla mot B:s bank, som i god tro tillgodogjort sig beloppet genom kvittning.","Bankbetalning,Enkelfordran,Kvittning,",T,6,J.O.F:s Reservdelar AB,Cs,Sparbanken Alingsås,Cs
T 4786-05,NJA 2008 s. 55,2008-01-18,Tillämpning av reglerna om strandskydd vid prövning av en ansökan om vattenverksamhet.,"Miljöbalken,Strandskydd,Vattenverksamhet,",T,11,"P.B.,T.U.,A.T.","Px,Px,Px",Värmdö kommun,Om
T 4796-05,NJA 2007 s. 792,2007-11-06,En arbetstagare hade vid tidpunkten för arbetsgivarens konkurs en lönefordran som grundade sig på innestående tid i en s.k. arbetstidsbank. Tiden hade intjänats tidigare än tre månader före konkursansökan. Fordringen har inte ansetts bestämd enligt en särskild beräkningsgrund och därmed inte omfattad av förmånsrätt och statlig lönegaranti.,"Arbetstidsbank,Förmånsrätt,Lönegaranti",T,15,F.K.,Pm,staten,Os
T 4816-05,NJA 2007 s. 684,2007-10-17,Negativ faderskaps- och moderskapstalan har tillåtits med stöd av 13 kap. 2 § rättegångsbalken.,"Rättegångsbalken,Föräldrabalken,Faderskap,",T,12,"A.E.,N-r E.,S-n E.,S-a E.,N-m E.","Px,Px,Px,Px,Px","M.N.,A.N.E.","Pw,Pm"
T 4825-07,NJA 2009 s. 94,2009-03-09,Utgångspunkten för preskriptionstid beträffande anspråk mellan försäkringsgivare på återkrav enligt trafikskadelagen.,"Trafikskadeersättning,Preskription,Återkrav,",T,23,If Skadeförsäkring AB,Cs,Motor Union Assuransfirma Aktiebolag,Cs
T 4961-05,NJA 2007 s. 540,2007-07-06,En treårig flicka har utsatts för sexuellt utnyttjande när hon sov. Flickan har ansetts berättigad till kränkningsersättning oavsett om hon blivit informerad om övergreppen.,"Skadestånd,Skada,Kränkning",T,23,åklagaren,Oa,H.V.,Pm
T 4990-07,NJA 2010 s. 434,2010-07-08,Eftersom det i ett mål om lönegaranti vid en helhetsbedömning inte visats vara fråga om ett missbruk av garantin har arbetstagarens fordran inte heller bedömts uppenbart överstiga vad som kan anses skäligt.,"Lönegaranti, Konkurs, Fördragskonform tolkning",T,"10,15",A.L.,Pw,staten genom Tillsynsmyndigheten i Skåne län,Ox
T 4998-06,NJA 1986 s. 702,2008-11-20,Fråga om intrång i gemenskapsvarumärke.,"Varumärke, Import, Intrång, Införsel",T,14,The North Face Apparel Corp.,Cf,S.B.,Pm
T 5042-06,NJA 2009 s. 388,2009-06-12,"Vid en entreprenad, som benämnts generalentreprenad och där standardformuläret AB 72 använts, har entreprenören åtagit sig viss projektering, och i entreprenadkontraktet har angetts att entreprenören har fullt ansvar för fel och brist som har samband med projektets funktion. Entreprenören har ansetts vara ansvarig för funktionen enligt såväl de särskilda villkoren i entreprenadkontraktet som bestämmelsen om uppgiftslämnarens ansvar i kap. 1 § 9 AB 72.","Entreprenad,Generalentreprenad,",T,6,Lulebo AB,Cs,Platzer Fastigheter Aktiebolag,Cs
T 5072-06,NJA 2010 s. 577,2010-11-25,När resning beviljats på den grunden att domstols rättstillämpning uppenbart strider mot lag har huvudregeln ansetts vara att domstolens bedömning också betraktas som så uppenbart oriktig att fel eller försummelse föreligger i den mening som avses i 3 kap. 2 § skadeståndslagen.,"Statens skadeståndsansvar, Resning",T,23,P.M.,Pm,Justitiekanslern,Os
T 593-06,NJA 2008 s. 339,2008-03-19,Sedan det i en dom fastställts att en kommun var skadeståndsskyldig på grund av försummelse av dess byggnadsnämnd har vid senare fullgörelsetalan uppkommit frågor om i vilken utsträckning kommunens invändningar om medvållande och bristande adekvat kausalitet blivit rättskraftigt avgjorda i fastställelseprocessen.,"Skadestånd,Adekvatkausalitet,Medvållande",T,,"Handelsbolaget Tylöbaden, W. & Co",Cs,Halmstads kommun,Om
T 672-06,NJA 2007 s. 584,2007-09-21,Sedan misstanke uppkommit om att barn utsatts för brott har barnen läkarundersökts efter beslut av polismyndighet. Beslutet har saknat lagstöd och ingreppet har ansetts strida mot artikel 8 Europakonventionen. Staten har befunnits vara skadeståndsskyldig mot barnen och deras föräldrar.,"Statensskadeståndsansvar,Europakonventionen,",T,5,"In.A.,L.A.,E.A.,B.A.,Is.A.","Pm,Pw,Pw,Pw,Pw",staten,Os
T 775-01,NJA 2002 s. 572,2002-11-22,Anställd har i fråga om rätt till lönegaranti vid konkurs inte ägt tillgodoräkna sig anställningstid hos sin förre arbetsgivare där han innehade företagsledande ställning.,"Lönegaranti,Förmånsrätt,Uppsägningstid",T,"10,15",J.-E.B.,Pm,staten genom Tillsynsmyndigheten i konkurser Kronofogdemyndigheten i Gävle,Os
T 823-00,NJA 2004 s. 52,2004-02-09,Vid vindikation av surrogat för leasingegendom hos tredje man har ersättningen ansetts böra beräknas utifrån egendomens värde vid tidpunkten för tredje mans förvärv av egendomen.,"Vindikation,Värdeersättning",T,6,SkandiaBanken AB,Cs,"Handelsbanken Finans AB,Maskin AB Erlandsson & Hjorth","Cs,Cs"
T 828-01,NJA 2002 s. 178,2002-04-11,"Fråga om en melodi, som utgjort ett upprepat och avgränsat inslag i en komposition på populärmusikens område, varit skyddad enligt upphovsrättslagen samt om intrång skett genom en senare tillkommen melodi på samma område.","Upphovsrätt,Musikalisktverk,Intrång,",T,14,EMI Music Publishing Scandinavia AB,Cs,Regatta Production AB,Cs
T 871-05,NJA 2007 s. 303,2007-05-11,"När en hyresgäst hyrt en lokal och tecknat nytt hyresavtal avseende en del av lokalen, har preskriptionsfristen enligt 12 kap. 61 § JB för fordringsanspråk avseende det ursprungliga hyresförhållandet beräknats från tidpunkten när det nya avtalet började gälla.","Preskriptionsfrist,Hyresförhållande,Lägenhet",T,19,Fastighetsaktiebolaget Uman,Cs,Aktiebolaget Burmans Ur och Guld ,Cs
T 875-00,NJA 2001 s. 742,2001-11-16,Ersättning för kränkning enligt 1 kap. 3 § skadeståndslagen i lydelse före den 1 januari 2002 har tillerkänts målsägande vid brottet sexuellt utnyttjande av underårig.,"Skadestånd,Kränkning,Målsägande,Sexualbrott",T,23,C.L.,Pw,M.L.,Pm
T 923-02,NJA 2005 s. 726,2005-11-03,Fråga om enskilds rätt till skadestånd av staten för att brottsmisstankar mot honom inte prövats i rättegång inom skälig tid. (Jfr NJA 2005 s. 462),"Skadestånd,Europakonventionen,Skäligtid,",T,23,M.Y.,Pm,Staten genom Justitiekanslern,Os
T 930-06,NJA 2008 s. 24,2008-01-04,"Fråga om rätt till avgångsvederlag för handelsagent vars uppdrag omfattat dels marknadsföring av tidsbegränsad nyttjanderätt till dataprogram, dels tillhandahållande av andra tjänster till kund. Analogisk tillämpning av 28 § lagen (1991:351) om handelsagentur.","Handelsagentur,Avgångsvederlag,Analogisk",T,6,E.E.,Px,Comtax AB ,Cs
T 989-02,NJA 2003 s. 285,2003-06-19,Fråga om regeringen gjort sig skyldig till fel eller försummelse vid bedömning av talerätt i ett strandskyddsärende.,"Skadestånd,Vårdslöshet,Strandskydd",T,23,"R.W.,I.W.","Px,Px",Staten genom Justitiekanslern,Os
B 1012-96,NJA 1998 s. 228,1998-04-09,Fråga om jäv enligt 4 kap 13 § 10 RB.,"Jäv,Europakonventionen,Domare",B,"18,8",åklagaren,Oa,H.W.,Pw
B 1020-90,NJA 1992 s. 150,1992-03-10,"Sedan åtal väckts för skattebedrägeri har den tilltalade dömts för skatteförseelse, Fråga huruvida åtalet skolat ogillas med hänsyn till bestämmelsen i 13 § skattebrottslagen (1971:69) att åtal för skatteförseelse endast får väckas om det är påkallat av särskilda skäl.","Åtalsprövning,Materiellprocessledning,",B,22,åklagaren,Oa,G.W.,Pm
B 1044-97,NJA 1997 s. 781,1997-11-19,Fråga om påföljd för grov förskingring m m.,"Brottspåföljd,Förskingring,Grovförskingring",B,8,åklagaren,Oa,J.P.,Pm
B 1047-96,NJA 1997 s. 507,1997-07-09,Rån eller utpressning?,"Rån,Utpressning",B,8,åklagaren,Oa,R.E.,Pm
B 1063-96,NJA 1996 s. 478,1996-09-02,Befattning med en liten mängd metadon har ansetts som narkotikabrott enligt 1 § narkotikastrafflagen (1968:64).,"Narkotikabrott,Narkotika,Metadon",B,8,åklagaren,Oa,J.K.,Pm
B 1092-92,NJA 1992 s. 470,1992-07-10,Fråga om påföljd för grov förskingring.,"Brottspåföljd,Förskingring",B,8,åklagaren,Oa,L.L.,Pw
B 1154-95,NJA 1997 s. 329,1997-05-23,"Påföljden för vägran att utföra vapenfri tjänst har bestämts till villkorlig dom och böter, trots att den dömde tidigare stått under åtal för liknande brott och därvid frikänts på grund av en brist i åklagarens gärningsbeskrivning.","Värnplikt,Totalförsvarsplikt,Vapenfritjänst,",B,8,åklagaren,Oa,M.H.,Pm
B 1156-92,NJA 1994 s. 480,1994-07-12,Olovligt förfogande? Tillämpningen av straffrättens legalitetsprincip.,"Olovligtförfogande,Legalitetsprincipen,",B,"8,5",åklagaren,Oa,C.B.,Pm
