case_num,publication_num,decision_date,court_provided_header,court_provided_keywords,court_provided_class,legal_area,applicant_names,applicant_class,respondent_names,respondent_class
B 7122-03,NJA 2005 s. 595,2005-07-26,"I mål om förverkande av vin enligt lagen (2000:1225) om straff för smuggling jämförd med alkohollagen (1994:1738) har HD hemställt hos EG-domstolen om förhandsavgörande beträffande tolkningen av artiklarna 28, 30 och 31 i EG-fördraget. Fråga, innan förhandsavgörande har meddelats, huruvida vinet skall vara underkastat beslag.","Beslag,Alkohol,Förhandsavgörande,Förverkande,",B,"8,18",åklagaren,Oa,,
B 7123-03,NJA 2007 s. 941,2007-12-04,I mål om förverkande av alkohol på grund av införsel i strid mot det s.k. privatimportförbudet i 4 kap. 2 § första stycket alkohollagen (1994:1738) har EG-domstolen i förhandsavgörande förklarat att importförbudet skall bedömas enligt artikel 28 i EG-fördraget och utgör en sådan kvantitativ importrestriktion som där är förbjuden samt att importförbudet inte är sådant att det ändå skall tillåtas med hänsyn till intresset att skydda människors hälsa och liv enligt artikel 30 i fördraget. Importförbudet har därför inte tillämpats i målet och förverkande har därmed inte lagligen kunnat ske. (Jfr NJA 2004 s. 137.),"Förverkande,Alkohollagen,Förhandsavgörande,",B,"8,5",åklagaren,Oa,K.R.,Px
B 719-03,NJA 2003 s. 121,2003-04-01,Stöld som begåtts efter intrång i bostad har med hänsyn till omständigheterna inte bedömts som grov stöld.,"Bostad,Grovstöld,Intrångibostad,Stöld",B,8,åklagaren,Oa,B.P.,Pm
B 736-03,NJA 2003 s. 133,2003-04-11,"Den tid om 45 dagar, som enligt art. 14 i den europeiska utlämningskonventionen skall ha förflutit innan den som utlämnats får, utan samtycke från den främmande staten, åtalas för annat, före hans utlämnande begånget brott än det för vilket han utlämnats, skall räknas från det att straffet har till fullo verkställts och inte från tidpunkten för villkorlig frigivning.","Utlämning,Specialitetsprincipen,Villkorvid",B,18,åklagaren,Oa,J.E.F.,Pm
B 948-03,NJA 2004 s. 840,2004-12-28,Fråga om ett slutligt beslut om miljösanktionsavgift utgör hinder för senare prövning av åtal för samma gärning (I och II). Dessutom fråga om bedömning av om viss gärning är ringa och därför fri från ansvar kan ske utan hinder av 51 kap. 23 a § RB (I) samt om åtalad gärning är att anse som ringa (I och II) och om förutsättningar föreligger för att meddela påföljdseftergift (I).,"Nebisinidem,Europakonventionen,",B,"8,11",åklagaren,Oa,M.E.,Px
B 965-03,NJA 2003 s. 313,2003-07-10,"Påföljden för en 18-åring som gjort sig skyldig till sexuellt utnyttjande av underårig har bestämts till fängelse. Tillika fråga om sekretess. TR:n har förordnat att vissa delar av domen skall omfattas av sekretess. Något sådant förordnande har dock inte meddelats beträffande motsvarande uppgifter som hade förebringats vid förhandling inom stängda dörrar, vilka uppgifter efter domen därför blev offentliga. Sekretessförordnandet har upphävts.","Brottspåföljd,Sexuelltutnyttjandeavbarn,",B,"8,18",åklagaren,Oa,F.I.,Pm
B 970-03,NJA 2004 s. 385,2004-06-11,Fråga om en enstaka transport kan anses utgöra olaga yrkesmässig trafik i den mening som avses i 6 kap. 1 § yrkestrafiklagen (1998:490).,"Yrkesmässigtrafik,Svarttaxi",B,"24,8",åklagaren,Oa,S.K.,Pm
B 991-03,NJA 2003 s. 174,2003-05-09,"En man har befunnits skyldig till grov misshandel och vållande till annans död, grovt brott, avseende en treårig styvson. Fråga om straffmätning. - Även fråga om barnets moder gjort sig skyldig till vållande till annans död genom att underlåta att se till att det misshandlade barnet kom under vård.","Grovmisshandel,Vållandetillannansdöd,",B,8,åklagaren,Oa,"I.M-D.,K.Z.","Pm,Pw"
T 1002-03,NJA 2004 s. 590,2004-10-21,Sakägarbegreppet enligt miljöbalken. Frågor i ansökningsmål rörande vattenverksamhet om sökandens skyldighet att betala ersättning för rättegångskostnad (I) och om rätt för andra än sökanden att överklaga domen (II).,"Sakägare,Fritidsfastighet,Part,",T,11,"Fortifikationsverket,Brännö Bys Samfällighetsförening","Om,Es","T.H. och medparter,S.G.,Ke.S.,M.G.,B.D.,G.S.,Kj.S.","Px,Px,Px,Px,Px,Px,Px"
T 1222-03,NJA 2004 s. 65,2004-02-20,Tingsrätten har i ett tvistigt mål om faderskap bestått av en beredningsjurist som ordförande och tre nämndemän. Domen har undanröjts eftersom tingsrätten inte var domför.,"Beredningsjurist,Tingsnotarie,Domförhet,",T,18,M.J.,Pw,U.S.,Pm
T 1399-03,NJA 2004 s. 746,2004-12-15,Fråga om skyldighet för passagerare i olovligt tillgripen bil att ersätta skada som uppkommit på bilen genom vårdslöshet från förarens sida (I och II).,"Skadestånd,Casusmixtus,Kausalitet,Olovligt",T,23,"åklagaren,Länsförsäkringar Sak Försäkringsaktiebolag,J.M.","Oa,Cs,Pm","F.O.,J.G.,M.W.,J.W.,I.W.","Px,Pm,Pm,Px,Pw"
T 1405-03,NJA 2005 s. 443,2005-06-09,Frågor om konkursförvaltares skadeståndsskyldighet för underlåtenhet att väcka talan om återvinning och för underlåtenhet att höra särskilt berörd borgenär i återvinningsfrågan.,"Skadestånd,Konkursförvaltare,Konkurs,",T,"10,23",Kronofogdemyndigheten,Oa,E.F.-S.,Pw
T 1421-03,NJA 2005 s. 745,2005-11-15,Ett i ett rättsskyddsförsäkringsavtal intaget avtalsvillkor har ansetts stå i strid mot föreskrifterna i 3 § lagen (1993:1303) om vissa avtalsvillkor för rättsskyddsförsäkring och vara ogiltigt.,"Rättsskyddsförsäkring,Rättsskyddsdirektivet,",T,23,Å.P.,Pm,Länsförsäkringar Västernorrland,Cs
T 1625-03,NJA 2004 s. 566,2004-10-14,Vägverket har ansetts inte berättigat till trafikskadeersättning för kostnader avseende vissa åtgärder som utförts på allmän väg efter en trafikolycka.,"Trafikskada,Trafikskadeersättning,Skadestånd,",T,23,Vägverket,Oa,Trygg-Hansa Försäkringsaktiebolag,Cs
T 173-03,NJA 2005 s. 309,2005-05-02,"Fråga om ett som arvskifte benämnt avtal mellan en efterlevande make och makarnas enda barn, tillika efterarvinge enligt testamente, inneburit att barnet avstått från sin rätt till efterarv.","Efterarvskatt,Efterarvinge,Bodelning,",T,12,L.N.,Pm,M.N.,Pw
T 184-03,NJA 2003 s. 384,2003-10-03,"Fråga huruvida en fastighetsägares och hyresvärds skadade egendom kunde anses befinna sig i en hyresgästs verksamhets omgivning, när egendomen förvarades i den lagerlokal där verksamheten bedrevs. 32 kap. 1 § MB.","Skadestånd,Miljöskada,Verksamhetsomgivning",T,"11,23",Hyr-Börsen i Roslagen AB (Hyr-Börsen),"Cs,Px",HCI Nordic AB (HCI),Cs
T 2082-03,NJA 2005 s. 557,2005-07-19,"Till ett bolag som skulle bedriva byggvaruhusrörelse upplät ett annat bolag för gemensam hyra dels en butikslokal på en fastighet, dels en annan fastighet för lagring och parkering. Sedan båda fastigheterna sålts till var sin ny ägare uppkommer frågan om nyttjanderättshavaren kunnat betala hela hyran till ägaren av den ena fastigheten med befriande verkan också gentemot den andre fastighetsägaren.","Betalning,Borgenärsbyte,Hyradeposition",T,"6,19",Enköpings tingsrätt Top Industri AB,Cs,Bålsta Byggvaror AB,Cs
T 2176-03,NJA 2003 s. 372,2003-09-26,Fråga huruvida umgänge skall vägras med hänsyn till risk för att barnet far illa. 6 kap. 2 a § 2 st. FB.,"Umgänge,Barn",T,12,R.H.,Pm,A.W.,Pw
T 2223-03,NJA 2004 s. 421,2004-06-21,Fråga huruvida transporter till och från en miljöfarlig verksamhets anläggningar är att anse som s.k. följdföretag enligt MB. Tillika fråga huruvida den som har ansökt om tillstånd enligt balken till utökad produktion av massa och papper bör åläggas att utreda och lämna förslag på villkor för sådana transporter med stöd av ett s.k. prövotidsförordnande.,"Miljöfarligverksamhet,Följdföretag,",T,11,Stora Enso Hylte AB,Cs,"Vänersborgs tingsrätt, miljödomstolen",Oa
T 2231-03,NJA 2005 s. 44,2005-02-11,Borgen. Ett aktiebolag som gått i konkurs och enligt bolagsrättsliga regler upplösts efter konkursens avslutande har varit gäldenär i ett fordringsförhållande. Bolagets upplösning har inte ansetts inverka på borgensansvaret för fordringen. Regeln i 8 § andra stycket preskriptionslagen (1981:130) om accessorisk preskription av fordran på grund av borgen har inte ansetts tillämplig när gäldenärsbolaget upplösts innan fordringen preskriberats mot bolaget.,"Borgen,Preskription,Aktiebolag,Konkurs",T,10,Staten genom Riksgäldskontoret,Os,V.J.,Pm
T 2609-03,NJA 2005 s. 738,2005-11-14,"En person har, sedan han gripits av polis, på polisstationen spottat en polisman rakt i ansiktet. För detta har han ålagts ansvar för ofredande enligt 4 kap. 7 § brottsbalken. Fråga om polismannen är berättigad till ersättning för kränkning enligt 2 kap. 3 § skadeståndslagen. (Jfr NJA 1999 s. 725.)","Skadestånd,Kränkning,Kränkningsersättning,",T,"23,8",åklagaren,Oa,M.A.G.,Pm
T 261-03,NJA 2004 s. 363,2004-06-09,Fråga om omfattningen av en beställares användarrätt vid uppdrag att utföra fotografering.,"Fotografi,Beställarrätt,Ställningsfullmakt",T,14,P.B.,Pm,Svenska Röda Korsets Centralstyrelse,Is
T 2699-03,NJA 2005 s. 943,2005-12-29,"Bostadsarrende. Vid inlösen av arrenderätt och av arrendatorn uppförd byggnad jämte övriga av denne utförda investeringar på arrendestället, skall lösenbeloppet i första hand fastställas till det samlade marknadsvärdet av den hembjudna egendomen.","Arrende,Lösenvärde,Lösenbelopp,Marknadsvärde",T,19,J.E.,Pm,S.A.,Pm
T 2934-03,NJA 2005 s. 180,2005-04-01,Mönsterintrång. Fråga om tillämpning av 35 kap. 5 § rättegångsbalken och 36 § andra meningen mönsterskyddslagen (1970:485) vid bestämmande av intrångsersättningen.,"Mönsterskydd,Inträng,Skadeståndsberäkning,",T,"14,18",Formsprutarna J-A.J. & Co AB,Cs,Merx Team AB,Cs
T 3040-03,NJA 2003 s. 527,2003-11-10,Talan om skadestånd mot domare i HovR för påstådda kränkningar av Europakonventionen om de mänskliga rättigheterna har ogillats utan att stämning utfärdats. (Jfr 2003 s. 217),"Uppenbartogrundadtalan,Skadestånd,Kränkning",T,"23,18",A.O,Pm,"A.-C.P., L.M., H.T.C., D.F., C.L., A.-K.J., T.R., H.K., G.B. och L.Å","Px,Px,Px,Px,Px,Px,Px"
T 3590-03,NJA 2004 s. 220,2004-04-30,En i ett skuldsaneringsärende okänd fordran som görs gällande efter skuldsaneringsbeslutet och då visar sig vara tvistig har ansetts inte undantagen från preklusionsverkan enligt 26 § skuldsaneringslagen (1994:334).,"Skuldsanering,Fordran,Preklusion",T,10,A.L.,Pw,U.R.,Pm
T 3807-03,NJA 2005 s. 502,2005-06-15,"Ett bilföretag köpte en begagnad bil av ett annat bilföretag. Trots att köparen före det aktuella köpet i inte obetydlig omfattning gjort bilaffärer med säljaren, har det ansetts att köparen inte gjort ett godtrosförvärv, eftersom någon undersökning av säljarens rätt att förfoga över bilen inte företagits.","Godtrosförvärv,Bil,Motorfordon,Köpavlös",T,6,GE Capital Bank AB,Cs,B.L. AB,Cs
T 3829-03,NJA 2007 s. 17,2007-01-30,Fråga om tolkning och tillämpning av ett villkor i en maskinförsäkring enligt vilket ersättning lämnas för plötslig och oförutsedd skada på försäkrad egendom.,"Försäkring,Avtalstolkning,Maskinförsäkring",T,"6,23",Scana Steel Components AB,Cs,If Skadeförsäkring AB,Cs
T 4088-03,NJA 2006 s. 136,2006-03-27,En revisor i ett aktiebolag vållade bolaget skada när han fullgjorde sitt uppdrag. Fråga om skadeståndet kan jämkas på grund av medvållande på bolagets sida.,"Aktiebolag,Bolagsorgan,Jämkning,Medvållande,",T,"23,7",Marknadsplan i Skandinavien Aktiebolag,Cs,C.R.,Px
T 4136-03,NJA 2005 s. 608,2005-09-12,"En tredje man som har handlat i samförstånd med ena parten i ett avtalsförhållande vid svek mot den andra parten har, eftersom handlandet bedömts vara kvalificerat otillbörligt, ansetts skyldig att ersätta ren förmögenhetsskada som handlandet orsakat.","Skadestånd,Renförmögenhetsskada,Svek,Tredje",T,23,Max Hamburgerrestauranger AB,Cs,Frasses Bar i Luleå AB,Cs
T 4513-03,NJA 2005 s. 843,2005-12-05,Fråga huruvida preskription avbrutits avseende skadeståndsanspråk mot landsting på grund av behandlingsskada.,"Preskription,Skadestånd,Patientförsäkring,",T,"23,6",K.P.,Pw,Skåne läns landsting ,Om
T 453-03,NJA 2004 s. 26,2004-02-04,Fråga om bestämmande av ersättning för personskada som till följd av dödsfall åsamkats någon som stod den avlidne särskilt nära.,"Skadestånd,Personskada,Anhörig",T,23,"Allmän åklagare,C.M,B.T,T.T,G.J","Oa,Px,Px,Px,Px",S.E.F,Pm
T 4824-03,NJA 2005 s. 425,2005-06-07,A köper en båt av B. Innan köpet blir sakrättsligt skyddat utmäts båten för B:s skulder och säljs på exekutiv auktion till C. A väcker talan mot C och begär att få ut båten mot lösen i enlighet med reglerna i lagen (1986:796) om godtrosförvärv av lösöre. Talan har ogillats. 14 kap. 2 § utsökningsbalken.,"Utmätning,Exekutivförsäljning,Godtrosförvärv,",T,6,"Mirabelle AS,Peculium AS","Cf,Cf",Aktiebolag Charterrederiet P. & L.,Cs
T 4853-03,NJA 2006 s. 721,2006-12-27,Fråga i mål angående trafikskadeersättning om beviskravet för att skadan har uppkommit i följd av trafik med ett okänt motorfordon och därvid orsakats genom vållande i samband med förandet av det okända fordonet.,"Trafikskadeersättning,Försäkring,Beviskrav",T,23,A.A.-W.,Pw,Trafikförsäkringsföreningen,Es
T 563-03,NJA 2006 s. 53,2006-02-24,Tolkning av försäkringsvillkor för olycksfallsskada.,"Försäkringsavtal,Tolkning,Olycksfallsskada",T,23,Ö.W.,Pm,Trygg-Hansa Försäkringsaktiebolag,Cs
T 742-03,NJA 2005 s. 324,2005-05-03,Frågor om beräkning och jämkning av trafikförsäkringsavgift.,"Trafikförsäkring,Jämkning,Försäkring",T,23,Trafikförsäkringsföreningen,Is,G.B.,Pw
T 953-03,NJA 2004 s. 862,2004-12-28,Skälig acceptfrist? 3 § avtalslagen.,"Acceptfrist,Avtal",T,6,"L.L.,B.L. ","Px,Px","E.H.,S.H. ","Px,Px"
B 125-98,NJA 1999 s. 362,1999-06-09,"Tilltalad, som i HovR:n dömts till åtta månaders fängelse för bl a försök till grov misshandel, har överklagat domen vad gäller ansvar, påföljd och skadestånd. Fråga om HovR:n med stöd av 51 kap 21 § sista stycket RB kunnat avgöra målet trots att den tilltalade inställt sig endast genom ombud.","Rättegångsfel,Huvudförhandling,Utevaro,",B,18,åklagaren,Oa,"R.I.,K.O.","Pm,Pm"
B 1638-98,NJA 2000 s. 92,2000-02-28,"En reservofficer, som av staten tilldelats ett skjutvapen som tjänstevapen, har dömts till ansvar för olaga vapeninnehav, sedan han behållit vapnet trots att skyldigheten för honom att inneha det bortfallit.","Vapen,Reservofficer,Tillstånd,Vapeninnehav",B,8,åklagaren,Oa,C.S.,Pm
B 1770-98,NJA 1999 s. 9,1999-02-03,Val av påföljd för grovt rattfylleri.,"Rattfylleri,Brottspåföljd",B,"8,18",åklagaren,Oa,A.H.,Pm
B 2060-98,NJA 1999 s. 215,1999-04-08,En rättslig kvalificering varigenom en gärning bedöms vara straffri har ansetts falla utanför tillämpningsområdet för 51 kap 23 a § RB. Även frågor om analogisk tillämpning av strafflag och om strafflags tillämplighet i tiden.,"Analogisklagtillämpning,Strafflags",B,"22,8,18",åklagaren,Oa,U.C.,Pm
B 2507-98,NJA 2001 s. 115,2001-03-14,Frågor om aktsamhetskravet i 7 § lagen (1943:459) om tillsyn över hundar och katter och om uppsåt till skadegörelse vid dödande av katt. Riksåklagaren godtog den tilltalades yrkande om frikännande dom och förklarade sig inte kunna bidra med ytterligare utredning. Förutsättningar för att avgöra målet utan huvudförhandling ansågs föreligga. 55 kap. 11 § och 51 kap. 13 § andra stycket rättegångsbalken.,"Husdjur,Skadegörelse,Tillsynslagen,",B,"23,8",åklagaren,Oa,M.R.,Pm
B 2521-98,NJA 1998 s. 512,1998-09-08,"Framställning av cannabis (marijuana) genom odling i hemmet har, med hänsyn till den mängd som producerats i förening med att odlingen bedrivits i stor skala, systematiskt och med användning av avancerad utrustning, bedömts som grovt narkotikabrott. - Även fråga om tillämpning av 51 kap 23 a § RB.","Narkotikabrott,Nöd,Cannabis,Marijuana",B,"8,18",åklagaren,Oa,J.L.,Pm
B 2643-98,NJA 1999 s. 480,1999-07-05,Bevisbedömning i mål om ansvar för olaga innehav av pistoler.,"Bevisvärdering,Besittning,Vapenbrott",B,8,åklagaren,Oa,B.S.,Pm
B 2648-98,NJA 1999 s. 749,1999-11-29,"Bilden av en känd skådespelare har utan dennes samtycke återgivits på baksidan av en periodisk tidskrift tillsammans med text, tidskriftens logotype och prisuppgift. Fråga har ansetts vara om en framställning av utpräglat kommersiell natur utgörande reklam för tidskriften och nyttjandet har medfört ansvar och ersättningsskyldighet enligt lagen om namn och bild i reklam.","Reklam,Tryckfrihet,Bild",B,4,"åklagaren, R.G.","Oa,Pm",J.K.,Px
B 3301-98,NJA 2000 s. 490,2000-10-17,Tillämpning av den straffrättsliga legalitetsprincipen. (Jfr NJA 1994 s 480).,"Legalitetsprincipen,Anläggning,Väglagen",B,8,åklagaren,Oa,S.L.,Pw
B 3852-98,NJA 2000 s. 234,2000-05-30,Fråga om ansvar för vårdslöshet i sjötrafik och vållande till kroppsskada.,"Sjölagen,Sjötrafik,Vållandetillkroppsskada,",B,"8,24",åklagaren,Oa,"N.V.,F.E.","Pm,Pm"
B 3877-98,NJA 1998 s. 713,1998-11-23,Reformatio in pejus? Tillika fråga om beaktande av tidigare brottslighet enligt bestämmelsen i 29 kap 4 § BrB.,"Reformatioinpejus,Förverkande,Villkorlig",B,18,åklagaren,Oa,J.F.,Pm
B 3942-98,NJA 1999 s. 25,1999-02-15,Fråga om rånbrott skall anses som grovt samt om påföljd för brottet. Även fråga om åklagaren i högre rätt får justera gärningsbeskrivningen till den tilltalades nackdel efter överklagande enbart i fråga om brottsrubricering och påföljd.,"Rån,Gärningsbeskrivning,Justeringavåtal,",B,"8,18",åklagaren,Oa,"Z.C.,A.P.,M.P.","Px,Px,Px"
B 4-98,NJA 1999 s. 87,1999-03-01,"Fråga om företagsbot skulle åläggas näringsidkare, på grund av brott mot miljöskyddslagen (1969:387) genom åsidosättande av koncessionsvillkor för mejeriverksamhet.","Företagsbot,Koncessionsvillkor,Näringsidkare",B,8,åklagaren,Oa,"S.S.,S.G., Norrlands Producentförening,","Pm,Pm,Cs"
B 4020-98,NJA 1998 s. 862,1998-12-22,Fråga om rättegångsfel förekommit i HovR genom att ett förhör tagits upp per telefon. 46 kap 7 § 2 st RB.,"Telefonförhör,Förhör,Rättegångsfel,",B,18,åklagaren,Oa,"S.D.,J.H.,K.W.","Pm,Pm,Pm"
B 4083-98,NJA 2000 s. 307,2000-06-16,Värdeförverkande enligt 9 § lagen (1960:418) om straff för varusmuggling har inte ansetts kunna ske hos den som enbart dömts för olovlig befattning med det insmugglade godset.,"Varusmuggling,Smuggling,Förverkande,Olovlig",B,8,åklagaren,Oa,G.O.,Pm
B 4575-98,NJA 1999 s. 275,1999-05-19,Överlämnande till journalist av fotografier med sikte på offentliggörande som illustrationer till en tidningsartikel har med hänsyn till meddelarfriheten enligt tryckfrihetsförordningen ansetts inte kunna föranleda straff för olaga hot eller hot mot tjänsteman.,"Meddelarfrihet,Tryckfrihet,Olagahot,Hotmot",B,"5,8",åklagaren,Oa,"C.F.,S.A.,G.H.,D.P.,D.D.","Pm,Px,Px,Px,Px"
B 4591-98,NJA 2000 s. 457,2000-10-06,Fråga huruvida en gärningsbeskrivning avseende åtal för försök till varusmuggling omfattat fullbordat brott mot anmälningsskyldigheten enligt privatinförsellagen.,"Åtal,Gärningsbeskrivning,Privatinförsel,",B,8,åklagaren,Oa,"T.Z.,T.E.","Px,Px"
B 4787-98,NJA 1999 s. 380,1999-06-11,Fråga om olovlig körning som skett efter det att gärningsmannen fått körkortet omhändertaget skall bedömas som grovt brott.,"Olovligkörning,Grovtbrott",B,8,åklagaren,Oa,M.L.,Pm
B 4836-98,NJA 2000 s. 661,2000-12-14,"I mål angående ansvar för ofredande har den tilltalade frikänts av tingsrätten, varefter åklagaren överklagat domen till hovrätten. Trots att den tilltalade uteblivit och målet delvis gällde bevisfrågor, hölls huvudförhandling i hovrätten, som därefter dömde den tilltalade för ofredande till ett bötesstraff. Även om det kunde ifrågasättas om hovrätten bort genomföra huvudförhandlingen i den tilltalades frånvaro, ansågs hovrättens handläggning inte utgöra rättegångsfel. - Den som uppsökt hyresgäst i bostaden och vid samtal med hyresgästen utanför dennas lägenhet med hög röst gjort kränkande uttalanden om hyresgästen har med hänsyn till omständigheterna ansetts inte ha gjort sig skyldig till ofredande.","Rättegångsfel,Utevaro,Europakonventionen,",B,"18,8",åklagaren,Oa,A.H.,Pm
B 4868-98,NJA 1999 s. 670,1999-10-27,"Två sambor har i Tyskland köpt in 315,3 liter sprit och 47,52 liter starköl och försökt föra in varorna till Sverige utan att ge detta till känna för tullmyndigheten. Då deras uppgift att varorna varit avsedda för privatbruk inte vederlagts, har förfarandet bedömts som förseelse mot privatinförsellagen och inte som brott mot varusmugglingslagen. 9 § 1 st lagen (1994:1565) om beskattning av privatinförsel av alkoholdrycker och tobaksvaror från land som är medlem i Europeiska unionen.","Alkoholdrycker,Privatinförsel,Smuggling,",B,8,åklagaren,Oa,"P.O.,A.B.","Px,Px"
B 4882-98,NJA 2001 s. 35,2001-01-31,Fråga om ansvar för tjänstefel av domare som bl.a. dröjt med att färdigställa tidigare avkunnade domar. Dessutom fråga om tillämpning av artikel 6 i Europakonventionen om de mänskliga rättigheterna angående rätten till en rättegång inom skälig tid.,"Tjänstefel,Domare,Förverkande,Villkorlig",B,"5,8",åklagaren,Oa,Carin A.,Pw
B 4933-98,NJA 1999 s. 485,1999-07-05,Deuterioamfetamin har ansetts vara narkotika enligt narkotikastrafflagen (1968:64).,"Narkotika,Amfetamin,Konventionstolknig",B,8,åklagaren,Oa,"J.C.,J.H.,P.L.,H.G.,G.H.,G.F.,R.O.","Px,Pm,Px,Px,Px,Pm,Px"
B 5297-98,NJA 1999 s. 269,1999-05-18,Villkorlig dom med föreskrift om samhällstjänst har ådömts för ett misshandelsbrott av normalgraden.,"Misshandel,Villkorligdom,Samhällstjänst,",B,"8,18",åklagaren,Oa,J.P.,Px
B 820-98,NJA 1998 s. 501,1998-08-31,I mål om utvisning har bl a förhållandena i utlänningens hemland (Somalia) ansetts böra leda till att det av humanitära skäl ej förordnades om utvisning.,"Utvisning,Humanitäraskäl",B,16,åklagaren,Oa,A.A.,Pm
T 105-98,NJA 1998 s. 574,1998-10-22,Fråga om skiljemannaarvodens skälighet. 23 § lagen (1929:145) om skiljemän.,"Skiljedom,Arvode,Skiljeman",T,18,NEMU Mitt i Sverige AB,Cs,"J.H,G.B,B.N","Px,Px,Px"
T 1352-98,NJA 1999 s. 131,1999-03-30,"Fråga om rätt för konkursförvaltare att, vid intressekonflikt mellan borgenärer, väcka talan om återvinning utan att den av processen berörde borgenären ställt säkerhet för samtliga rättegångskostnader.","Konkurs,Konkursförvaltare,Säkerhet,",T,10,Svenska Handelsbanken AB,Cs,S.O.,Pm
T 1493-98,NJA 2000 s. 48,2000-01-21,"Ett ombud för en försäkringstagare har ansetts berättigad till ersättning ur rättsskyddsförsäkring, oavsett om försäkringstagaren gått I konkurs. Tillika fråga om preskription.","Rättsskyddsförsäkring,Ombud,Tredjemansavtal,",T,6,Phoenix Forum AB,Cs,"Wasa Sakförsäkring,Folksam,Holmia Försäkring AB,Länsförsäkringar Skåne,Försäkrings AB Skandia,Trygg-Hansa Försäkrings AB","Cs,Cs,Cs,Cs,Cs,Cs"
T 1857-98,NJA 2000 s. 747,2000-12-29,"När köp av fast egendom skett genom att parterna undertecknat köpehandlingen vid skilda tillfällen, har köpet inte ansetts fullbordat redan genom den andra underskriften. Köpet har dock blivit bindande genom att köpehandlingen utgivits till den anlitade mäklaren (I) men inte genom att den överlämnats till den sist undertecknande partens ombud (II).","Köpavfastegendom,Undertecknande,Köpeavtal,",T,"6,19","K-Å.J.,C.E.,A.E.,P.E.","Pm,Px,Px,Px","P.K.,K.V.,H.S.,L.S. ","Px,Px,Pm,Pw"
T 1883-98,NJA 2000 s. 31,2000-01-11,Fråga om tillämpning av preskriptionsbestämmelsen i 18 kap 9 § handelsbalken beträffande anspråk på skadestånd som uppdragsgivare har mot fastighetsmäklare.,"Preskription,Fastighetsmäklare,Skadestånd",T,6,I.E.,Px,M.N.,Pw
T 2305-98,NJA 2000 s. 137,2000-03-22,Fråga om tillämpning av preskriptionsbestämmelsen i 18 kap. 9 § handelsbalken beträffande skadeståndsanspråk mot advokat.,"Preskription,Advokat,Syssloman,Skadestånd",T,6,L.A.,Pm,M.M.,Pm
T 2328-98,NJA 2002 s. 17,2002-01-10,Fråga om skadeståndsskyldighet på grund av oredligt förfarande vid kreditköp.,,T,6,Fiberdata AB,Cs,S.L.,Pm
T 2417-98,NJA 2000 s. 712,2000-12-22,Fråga om skadestånd enligt lagen (1992:1528) om offentlig upphandling,"Offentligupphandling,Skadestånd,Upphandling",T,20,"TVÄTTSVAMPARNA, RENT & FINT HB ",Cs,Ekerö kommun,Om
T 2567-98,NJA 1999 s. 260,1999-05-18,Fråga om domstols skyldighet att klarlägga innebörden av gjort vitsordande av skadeståndsbelopp i brottmål. 46 kap 4 § 2 st RB.,"Processledning,Rättegångsfel,Skadestånd",T,"18,23",K.H.,Pm,"N.M.Y.,D.C.,F.K.","Pm,Pm,Pm"
T 2814-98,NJA 2000 s. 150,2000-04-06,En bilförare med hög alkoholkoncentration i blodet har kört av vägen och skadat sig allvarligt. Orsaken till olyckan har inte kunnat klarläggas men omständigheterna har varit sådana att det har funnits en tänkbar förklaring som inte har förutsatt att föraren varit vårdslös. Ojämkad trafikskadeersättning har tillerkänts föraren.,"Trafikskada,Jämkning,Personskada,",T,"23,8",S-O.P,Px,Länsförsäkringsbolagens Aktiebolag,Cs
T 2869-98,NJA 2000 s. 445,2000-10-06,Kan fler än en organisation vara behöriga att kräva in droit de suite-ersättning enligt 26 j § upphovsrättslagen?,"Upphovsrätt,Droitdesuite",T,14,Bildkonst Upphovsrätt i Sverige ,Xs,Konstnärernas Intresseförening för droit de suite upphovsrätt i Sverige,Is
T 2955-98,NJA 2000 s. 202,2000-04-27,Den som under ett pågående förfarande om inlösen av minoritetsaktier förvärvar aktier som förfarandet gäller har ansetts vara berättigad att inträda som part i förfarandet.,"Inlösen,Minoritetsaktier,Partssuccession,",T,"3,7",D.H.,Pm,Trygg-Hansa AB,Cs
